<!--
    creators.dtd
-->

<!ELEMENT creators (creator*)>

<!ELEMENT creator (description*)>
<!ATTLIST creator type CDATA #IMPLIED>
<!ATTLIST creator class CDATA #IMPLIED>

<!ELEMENT description (#PCDATA)>
